<?xml version="1.0" encoding="UTF-8"?>
<xs:schema xmlns="https://www.uniovi.es" elementFormDefault="qualified" targetNamespace="https://www.uniovi.es" xmlns:xs="http://www.w3.org/2001/XMLSchema">

	<xs:simpleType name="tAnchuraCircuito">
		<xs:restriction base="xs:positiveInteger">
			<xs:minInclusive value="1"/>
			 <xs:maxInclusive value="200"/>
		</xs:restriction>
	</xs:simpleType>

	<xs:simpleType name="tLongitudCircuito">
		<xs:restriction base="xs:positiveInteger">
			<xs:minInclusive value="1"/>
			<xs:maxInclusive value="20000"/>
		</xs:restriction>
	</xs:simpleType>

	<xs:simpleType name="cordAltura">
		<xs:restriction base="xs:float">
			<xs:minInclusive value="1"/>
			<xs:maxInclusive value="5000"/>
		</xs:restriction>
	</xs:simpleType>
	<xs:simpleType name="cordLatitud">
		<xs:restriction base="xs:float">
			<xs:minInclusive value="-90"/>
			<xs:maxInclusive value="90"/>
		</xs:restriction>
	</xs:simpleType>

	<xs:simpleType name="cordLongitud">
		<xs:restriction base="xs:float">
			<xs:minInclusive value="-180"/>
			 <xs:maxInclusive value="180"/>
		</xs:restriction>
	</xs:simpleType>



	<xs:element name="circuito">
		<xs:complexType mixed="true">
			<xs:sequence>
				<xs:any minOccurs="0" maxOccurs="unbounded" namespace="https://www.uniovi.es" />
			</xs:sequence>
		</xs:complexType>
	</xs:element>
	<xs:element name="nombre" type="xs:string" />
	<xs:element name="distancia">
		<xs:complexType>
			<xs:simpleContent>
				<xs:extension base="tLongitudCircuito">
					<xs:attribute name="unidades" type="xs:string" use="required" />
				</xs:extension>
			</xs:simpleContent>
		</xs:complexType>
	</xs:element>
	<xs:element name="ancho">
		<xs:complexType>
			<xs:simpleContent>
				<xs:extension base="tAnchuraCircuito">
					<xs:attribute name="unidades" type="xs:string" use="required" />
				</xs:extension>
			</xs:simpleContent>
		</xs:complexType>
	</xs:element>
	<xs:element name="fecha" type="xs:date" />
	<xs:element name="hora" type="xs:time" />
	<xs:element name="vueltas" type="xs:string" />
	<xs:element name="localidad" type="xs:string" />
	<xs:element name="pais" type="xs:string" />
	<xs:element name="patrocinadorPrincipal" type="xs:string" />
	<xs:element name="referencias">
		<xs:complexType>
			<xs:sequence>
				<xs:element minOccurs="3" maxOccurs="unbounded" ref="enlace" />
			</xs:sequence>
		</xs:complexType>
	</xs:element>
	<xs:element name="enlace">
		<xs:complexType>
			<xs:simpleContent>
				<xs:extension base="xs:string">
					<xs:attribute name="alt" type="xs:string" use="required" />
				</xs:extension>
			</xs:simpleContent>
		</xs:complexType>
	</xs:element>
	<xs:element name="imagenes">
		<xs:complexType>
			<xs:sequence>
				<xs:element minOccurs="1" maxOccurs="3" ref="img" />
			</xs:sequence>
		</xs:complexType>
	</xs:element>
	<xs:element name="img">
		<xs:complexType>
			<xs:simpleContent>
				<xs:extension base="xs:string">
					<xs:attribute name="alt" type="xs:string" use="required" />
				</xs:extension>
			</xs:simpleContent>
		</xs:complexType>
	</xs:element>
	<xs:element name="videos">
		<xs:complexType>
			<xs:sequence>
				<xs:element minOccurs="1" maxOccurs="3" ref="video" />
			</xs:sequence>
		</xs:complexType>
	</xs:element>
	<xs:element name="video">
		<xs:complexType>
			<xs:simpleContent>
				<xs:extension base="xs:string">
					<xs:attribute name="tipo" type="xs:string" use="required" />
					<xs:attribute name="titulo" type="xs:string" use="required" />
				</xs:extension>
			</xs:simpleContent>
		</xs:complexType>
	</xs:element>
	<xs:element name="coordenada">
		<xs:complexType>
			<xs:sequence>
				<xs:element ref="latitud" />
				<xs:element ref="longitud" />
				<xs:element ref="altitud" />
			</xs:sequence>
		</xs:complexType>
	</xs:element>
	<xs:element name="latitud">
		<xs:complexType>
			<xs:simpleContent>
				<xs:extension base="cordLatitud">
					<xs:attribute name="unidades" type="xs:string" use="required" />
				</xs:extension>
			</xs:simpleContent>
		</xs:complexType>
	</xs:element>
	<xs:element name="longitud">
		<xs:complexType>
			<xs:simpleContent>
				<xs:extension base="cordLongitud">
					<xs:attribute name="unidades" type="xs:string" use="required" />
				</xs:extension>
			</xs:simpleContent>
		</xs:complexType>
	</xs:element>
	<xs:element name="altitud">
		<xs:complexType>
			<xs:simpleContent>
				<xs:extension base="cordAltura">
					<xs:attribute name="unidades" type="xs:string" use="required" />
				</xs:extension>
			</xs:simpleContent>
		</xs:complexType>
	</xs:element>
	<xs:element name="segmentos">
		<xs:complexType>
			<xs:sequence>
				<xs:element minOccurs="1" maxOccurs="unbounded" ref="segmento" />
			</xs:sequence>
		</xs:complexType>
	</xs:element>
	<xs:element name="segmento">
		<xs:complexType>
			<xs:sequence>
				<xs:element ref="distancia" />
				<xs:element ref="longitud" />
				<xs:element ref="latitud" />
				<xs:element ref="altitud" />
			</xs:sequence>
			<xs:attribute name="sector" use="required">
				<xs:simpleType>
					<xs:restriction base="xs:NMTOKEN">
						<xs:enumeration value="1" />
						<xs:enumeration value="2" />
						<xs:enumeration value="3" />
					</xs:restriction>
				</xs:simpleType>
			</xs:attribute>
		</xs:complexType>
	</xs:element>
	<xs:element name="vencedor">
		<xs:complexType>
			<xs:simpleContent>
				<xs:extension base="xs:string">
					<xs:attribute name="duracion" type="xs:duration" use="required" />
				</xs:extension>
			</xs:simpleContent>
		</xs:complexType>
	</xs:element>
	<xs:element name="clasificacion">
		<xs:complexType>
			<xs:sequence>
				<xs:element minOccurs="3" maxOccurs="3" ref="piloto" />
			</xs:sequence>
		</xs:complexType>
	</xs:element>
	<xs:element name="piloto">
		<xs:complexType>
			<xs:simpleContent>
				<xs:extension base="xs:string">
					<xs:attribute name="clasificacion" use="required">
						<xs:simpleType>
							<xs:restriction base="xs:NMTOKEN">
								<xs:enumeration value="1" />
								<xs:enumeration value="2" />
								<xs:enumeration value="3" />
							</xs:restriction>
						</xs:simpleType>
					</xs:attribute>
				</xs:extension>
			</xs:simpleContent>
		</xs:complexType>
	</xs:element>
</xs:schema>